{
  "id": "request_recovery_resume_from_last_seq",
  "feature": "request_recovery",
  "description": "Resume a streaming request after acknowledging the first chunk and verify ordered replay plus the final marker.",
  "request": {
    "user_id": "conformance-user",
    "name": "conformance-request-recovery-resume-session",
    "description": "session for request recovery resume fixture",
    "namespace": "conformance",
    "tool_name": "conformance_recovery_resume",
    "tool_description": "conformance request recovery resume tool",
    "params": {
      "prefix": "resume",
      "count": 5
    },
    "wait_for_next_seq_at_least": 2,
    "resume_from_seq": 1
  },
  "expected": {
    "request_id_non_empty": true,
    "final_status_equals": "done",
    "resume_ordered_chunks": [
      "resume-2",
      "resume-3",
      "resume-4",
      "resume-5"
    ],
    "final_marker": true,
    "final_seq_equals": 6,
    "start_seq_equals": 1,
    "next_seq_equals": 6
  },
  "tags": ["core", "request", "recovery", "resume"]
}